{
  "version": 1,
  "name": "Kiosk Scene starter",
  "adapter": "static",
  "assetRoot": "./",
  "entry": "./avatar-placeholder.svg",
  "modelUrl": "./avatar-placeholder.svg",
  "fallbackPortrait": "./avatar-placeholder.svg",
  "capabilities": {
    "supportsEmotion": false,
    "supportsMotion": false,
    "supportsViewPresets": true,
    "supportsLipSync": false,
    "supportsPointerFocus": false
  }
}
